17:23:02.042537 IP (tos 0x0, ttl 64, id 20040, offset 0, flags [DF], proto TCP (6), length 60)
    luckyvan-VirtualBox.local.42982 > kix01s01-in-f8.1e100.net.http: Flags [S], cksum 0x4283 (incorrect -> 0x0e78), seq 2182702334, win 14600, options [mss 1460,sackOK,TS val 69675702 ecr 0,nop,wscale 7], length 0
17:23:02.157647 IP (tos 0x0, ttl 64, id 61863, offset 0, flags [none], proto TCP (6), length 44)
    kix01s01-in-f8.1e100.net.http > luckyvan-VirtualBox.local.42982: Flags [S.], cksum 0xcdc2 (correct), seq 1320069633, ack 2182702335, win 65535, options [mss 1460], length 0
17:23:02.157704 IP (tos 0x0, ttl 64, id 20041, offset 0, flags [DF], proto TCP (6), length 40)
    luckyvan-VirtualBox.local.42982 > kix01s01-in-f8.1e100.net.http: Flags [.], cksum 0x426f (incorrect -> 0xac77), ack 1, win 14600, length 0
17:23:02.158054 IP (tos 0x0, ttl 64, id 20042, offset 0, flags [DF], proto TCP (6), length 1336)
    luckyvan-VirtualBox.local.42982 > kix01s01-in-f8.1e100.net.http: Flags [P.], cksum 0x477f (incorrect -> 0x3a2e), seq 1:1297, ack 1, win 14600, length 1296
17:23:02.158626 IP (tos 0x0, ttl 64, id 61864, offset 0, flags [none], proto TCP (6), length 40)
    kix01s01-in-f8.1e100.net.http > luckyvan-VirtualBox.local.42982: Flags [.], cksum 0xe06f (correct), ack 1297, win 65535, length 0
17:23:02.161020 IP6 (hlim 255, next-header UDP (17) payload length: 48) fe80::a00:27ff:fe23:a3bc.mdns > ff02::fb.mdns: [udp sum ok] 0 PTR (QM)? 15.2.0.10.in-addr.arpa. (40)
17:23:02.318123 IP (tos 0x0, ttl 64, id 61865, offset 0, flags [none], proto TCP (6), length 996)
    kix01s01-in-f8.1e100.net.http > luckyvan-VirtualBox.local.42982: Flags [P.], cksum 0x1310 (correct), seq 1:957, ack 1297, win 65535, length 956
17:23:02.318149 IP (tos 0x0, ttl 64, id 20043, offset 0, flags [DF], proto TCP (6), length 40)
    luckyvan-VirtualBox.local.42982 > kix01s01-in-f8.1e100.net.http: Flags [.], cksum 0x426f (incorrect -> 0x9d37), ack 957, win 16252, length 0
17:23:02.320402 IP (tos 0x0, ttl 64, id 52506, offset 0, flags [DF], proto TCP (6), length 60)
    luckyvan-VirtualBox.local.45012 > tb-in-f101.1e100.net.http: Flags [S], cksum 0x761f (incorrect -> 0xeede), seq 3808028646, win 14600, options [mss 1460,sackOK,TS val 69675772 ecr 0,nop,wscale 7], length 0
17:23:02.399629 IP (tos 0x0, ttl 64, id 61866, offset 0, flags [none], proto TCP (6), length 44)
    tb-in-f101.1e100.net.http > luckyvan-VirtualBox.local.45012: Flags [S.], cksum 0xb46e (correct), seq 1320133633, ack 3808028647, win 65535, options [mss 1460], length 0
17:23:02.399677 IP (tos 0x0, ttl 64, id 52507, offset 0, flags [DF], proto TCP (6), length 40)
